sample_id,thermite_system,cqd_source,cqd_concentration,video_fps,frame_start,frame_end,burn_distance_mm,burn_time_s,burn_rate_mm_s,flame_area_mm2,flame_length_mm,flame_brightness_mean,image_quality,note
m,Al-MoO3,none,0,2000,120,164,30,,1363.64,118.2,24.1,142.5,high,baseline without CQD
mo1,Al-MoO3,orange_peel,1,2000,118,158,30,,1500.00,132.4,26.7,153.2,high,orange peel CQD low level
mo2,Al-MoO3,orange_peel,2,2000,121,156,30,,1714.29,151.8,30.4,168.7,high,orange peel CQD level 2
mo3,Al-MoO3,orange_peel,3,2000,116,153,30,,1621.62,146.2,29.8,163.1,medium,orange peel CQD level 3; slight frame boundary uncertainty
mo4,Al-MoO3,orange_peel,4,2000,119,161,30,,1428.57,128.7,25.5,149.4,medium,orange peel CQD high level; possible saturation
mb1,Al-MoO3,banana_peel,1,2000,122,160,30,,1578.95,139.6,27.9,158.6,high,banana peel CQD low level
mb2,Al-MoO3,banana_peel,2,2000,117,151,30,,1764.71,158.3,31.6,174.2,high,banana peel CQD level 2
mb3,Al-MoO3,banana_peel,3,2000,120,157,30,,1621.62,144.9,29.2,164.8,medium,banana peel CQD level 3; repeat recommended
mb4,Al-MoO3,banana_peel,4,2000,123,169,30,,1304.35,119.8,23.8,140.1,low,banana peel CQD high level; image blur affects reading
